{
  "dossier_id": "D-PILOTE-RES-003",
  "step": "valuation-draft",
  "artifact": "hypotheses_explicites.json",
  "hypotheses": [
    {
      "hypothese_id": "H-201",
      "description": "Renovations recentes a confirmer avant sortie client.",
      "source_ids": [
        "SRC-INSPECTION-201"
      ]
    }
  ],
  "confidence": 0.78,
  "source_fixture": "case_pilote_revision_conformite.json"
}