{
  "dossier_id": "D-PILOTE-RES-002",
  "step": "valuation-draft",
  "artifact": "hypotheses_explicites.json",
  "hypotheses": [
    {
      "hypothese_id": "H-101",
      "description": "Ajustement qualitatif pour secteur moins comparable.",
      "source_ids": [
        "SRC-VENTE-101"
      ]
    }
  ],
  "confidence": 0.52,
  "source_fixture": "case_pilote_confiance_limitee.json"
}