{
  "dossier_id": "D-PILOTE-RES-001",
  "step": "valuation-draft",
  "artifact": "hypotheses_explicites.json",
  "hypotheses": [
    {
      "hypothese_id": "H-001",
      "description": "Condition interieure comparable a la moyenne du secteur.",
      "source_ids": [
        "SRC-INSPECTION-001",
        "SRC-PHOTO-001"
      ]
    }
  ],
  "confidence": 0.88,
  "source_fixture": "case_pilote_residentiel_standard.json"
}